[
  {
    "country_name": "Aruba",
    "alpha2_code": "AW",
    "alpha3_code": "ABW",
    "numeric_code": 533,
    "source": {
      "source_url": "https://www.cbaruba.org/monthly-tables/",
      "source_url_2": null,
      "notes": null
    },
    "target": {
      "data_type": "PDF Bulletin",
      "direct_download_url": "https://www.cbaruba.org/document/monthly-tables-2026/",
      "update_frequency": "Monthly",
      "requires_js": true,
      "notes": "Requires PDF parsing via pdfplumber. Target document: Monthly Tables (under [https://www.cbaruba.org/document/monthly-tables-YYYY](https://www.cbaruba.org/document/monthly-tables-YYYY)). Target table: 'TABLE 2: COMPONENTS OF BROAD MONEY' (page 4). FCD is calculated as Col(5) [Demand deposits - Foreign currency] + Col(9) [Other deposits - Savings - Foreign currency] + Col(11) [Other deposits - Time - Foreign currency]. Total Deposits (TD) is calculated as Col(6) [Demand deposits - Total] + Col(12) [Other deposits - Total]. Header Forward Fill (ffill) is required due to merged header cells."
    }
  },
  {
    "country_name": "Afghanistan",
    "alpha2_code": "AF",
    "alpha3_code": "AFG",
    "numeric_code": 4,
    "source": {
      "source_url": "https://dab.gov.af/Annual-Economic-and-Statistical-Bulletins",
      "source_url_2": null,
      "notes": "Annuel Economic Bulletin -> Table 2.1 Monetary aggregate -> 3- Broad Money(M2) -> Other Deposits (Quasi Money) -> In Foreign currency"
    },
    "target": {
      "data_type": "PDF Bulletin",
      "direct_download_url": "https://dab.gov.af/quarterly-economic-and-statistical-bulletins",
      "update_frequency": "Quarterly",
      "requires_js": false,
      "notes": "Requires Playwright to crawl bulletin links and fetch PDFs. Parse Table 2.1 (Monetary Aggregates). FCD = 'In Foreign Currency' under Other Deposits. TD = Demand Deposits + Other Deposits."    }
  },
  {
    "country_name": "Angola",
    "alpha2_code": "AO",
    "alpha3_code": "AGO",
    "numeric_code": 24,
    "source": {
      "source_url": "https://www.bna.ao/Conteudos/Temas/lista_temas.aspx?idc=311&idsc=14121&idl=1",
      "source_url_2": "https://www.bna.ao/Conteudos/All/lista.aspx?idc=15650&idsc=15651&idl=1",
      "notes": null
    },
    "target": {
      "data_type": "Direct Excel",
      "direct_download_url": "https://www.bna.ao/",
      "update_frequency": "Monthly",
      "requires_js": true,
      "notes": "사이트 인증서 오류로 자동접근 불가. 검색결과에 따르면 '통계>Estatisticas Monetarias e Financeiras' 메뉴에서 EMF Nova Serie 엑셀파일 제공 확인(bancobai 자료 인용)"
    }
  },
  {
    "country_name": "Anguilla",
    "alpha2_code": "AI",
    "alpha3_code": "AIA",
    "numeric_code": 660,
    "source": {
      "source_url": "https://www.eccb-centralbank.org/n/selected-monetary-and-financial-statistics",
      "source_url_2": null,
      "notes": null
    },
    "target": {
      "data_type": "Interactive Web",
      "direct_download_url": "https://www.eccb-centralbank.org/statistics-category/monetary-and-financial-statistics/summarized-monetary-survey",
      "update_frequency": "Annual/Quarterly",
      "requires_js": true,
      "notes": "Statistics>Monetary and Financial Sector>Summarized Monetary Survey, Country=Anguilla 선택 후 Foreign Currency Deposits 항목 확인, Download 버튼으로 Excel 추출 가능"
    }
  },
  {
    "country_name": "Åland Islands",
    "alpha2_code": "AX",
    "alpha3_code": "ALA",
    "numeric_code": 248,
    "source": {
      "source_url": null,
      "source_url_2": null,
      "notes": null
    },
    "target": {
      "data_type": null,
      "direct_download_url": null,
      "update_frequency": null,
      "requires_js": null,
      "notes": "해당 지역(올란드 제도)은 독립 중앙은행이 없으며 핀란드/ECB 통계에 포함됨. Source URL 없음"
    }
  },
  {
    "country_name": "Albania",
    "alpha2_code": "AL",
    "alpha3_code": "ALB",
    "numeric_code": 8,
    "source": {
      "source_url": "https://www.bankofalbania.org/Statistics/Monetary_Financial_and_Banking_statistics/Deposits.html?evb=agregate&evn=agregate_detaje&cregtab_id=639&periudha_id=1",
      "source_url_2": null,
      "notes": null
    },
    "target": {
      "data_type": "Interactive Web",
      "direct_download_url": "https://www.bankofalbania.org/Statistics/Monetary_Financial_and_Banking_statistics/Deposits.html?evb=agregate&evn=agregate_detaje&cregtab_id=741&periudha_id=1",
      "update_frequency": "Monthly",
      "requires_js": true,
      "notes": "Monetary,Financial and Banking statistics>Deposits>\"Foreign currency deposits converted in ALL by sector and maturity\"(cregtab_id=741) 클릭 후 Show values로 테이블 조회, 별도 엑셀다운로드 버튼 없음(웹 테이블만 제공)"
    }
  },
  {
    "country_name": "Andorra",
    "alpha2_code": "AD",
    "alpha3_code": "AND",
    "numeric_code": 20,
    "source": {
      "source_url": null,
      "source_url_2": null,
      "notes": null
    },
    "target": {
      "data_type": null,
      "direct_download_url": null,
      "update_frequency": null,
      "requires_js": null,
      "notes": "안도라는 자체 중앙은행 없음(INAF가 유사기능). 공개된 시계열 통계 페이지 확인 안됨, Source URL 없음"
    }
  },
  {
    "country_name": "United Arab Emirates (the)",
    "alpha2_code": "AE",
    "alpha3_code": "ARE",
    "numeric_code": 784,
    "source": {
      "source_url": "https://www.centralbank.ae/en/statistics/monthly-statistics",
      "source_url_2": "https://www.centralbank.ae/en/publications",
      "notes": null
    },
    "target": {
      "data_type": "PDF Bulletin",
      "direct_download_url": "https://www.centralbank.ae/media/r0mirede/statistical-bulletin-may-2026.pdf",
      "update_frequency": "Monthly",
      "requires_js": true,
      "notes": "Research and Statistics>Statistics by Theme>\"Statistical Bulletin-Banking & Monetary Statistics\">월별 항목 클릭 후 상세페이지에서 PDF Download"
    }
  },
  {
    "country_name": "Argentina",
    "alpha2_code": "AR",
    "alpha3_code": "ARG",
    "numeric_code": 32,
    "source": {
      "source_url": "https://www.bcra.gob.ar/PublicacionesEstadisticas/Cuadros_estandarizados_series_estadisticas_i.asp?prevPage=stat",
      "source_url_2": null,
      "notes": null
    },
    "target": {
      "data_type": "PDF Bulletin",
      "direct_download_url": "https://www.bcra.gob.ar/listado-boletin-estadistico/",
      "update_frequency": "Monthly",
      "requires_js": false,
      "notes": "Boletín Estadístico(월간) 목록에서 최신월 클릭 시 PDF 내 Excel(.xls) 시리즈 링크 포함, 예: dep....xls 형태로 개별 시리즈 다운 가능"
    }
  },
  {
    "country_name": "Armenia",
    "alpha2_code": "AM",
    "alpha3_code": "ARM",
    "numeric_code": 51,
    "source": {
      "source_url": "https://databank.cba.am/",
      "source_url_2": null,
      "notes": null
    },
    "target": {
      "data_type": "Interactive Web",
      "direct_download_url": "https://www.cba.am/en/statistics/commercial-banks-loans-by-sectors/152",
      "update_frequency": "Monthly",
      "requires_js": true,
      "notes": "Statistics>Deposits>Commercial banks deposits by sectors; interactive filterable table by sector/currency, no direct file download"
    }
  },
  {
    "country_name": "American Samoa",
    "alpha2_code": "AS",
    "alpha3_code": "ASM",
    "numeric_code": 16,
    "source": {
      "source_url": null,
      "source_url_2": "https://www.cba.am/en/SitePages/statmonetaryfinancial.aspx",
      "notes": null
    },
    "target": {
      "data_type": null,
      "direct_download_url": null,
      "update_frequency": null,
      "requires_js": null,
      "notes": "No central bank; uses US Federal Reserve System. No standalone monetary statistics source found for American Samoa"
    }
  },
  {
    "country_name": "Antarctica",
    "alpha2_code": "AQ",
    "alpha3_code": "ATA",
    "numeric_code": 10,
    "source": {
      "source_url": null,
      "source_url_2": null,
      "notes": null
    },
    "target": {
      "data_type": null,
      "direct_download_url": null,
      "update_frequency": null,
      "requires_js": null,
      "notes": "No central bank; Antarctica has no permanent population or banking system"
    }
  },
  {
    "country_name": "French Southern Territories (the)",
    "alpha2_code": "TF",
    "alpha3_code": "ATF",
    "numeric_code": 260,
    "source": {
      "source_url": null,
      "source_url_2": null,
      "notes": null
    },
    "target": {
      "data_type": null,
      "direct_download_url": null,
      "update_frequency": null,
      "requires_js": null,
      "notes": "No central bank; French Southern Territories administered by France, uses French/EU statistics"
    }
  },
  {
    "country_name": "Antigua and Barbuda",
    "alpha2_code": "AG",
    "alpha3_code": "ATG",
    "numeric_code": 28,
    "source": {
      "source_url": "https://www.eccb-centralbank.org/n/selected-monetary-and-financial-statistics",
      "source_url_2": null,
      "notes": null
    },
    "target": {
      "data_type": "Interactive Web",
      "direct_download_url": "https://www.eccb-centralbank.org/statistics-category/monetary-and-financial-statistics/summarized-monetary-survey",
      "update_frequency": "Monthly",
      "requires_js": true,
      "notes": "ECCB regional central bank covers Antigua and Barbuda; Statistics>Monetary and Financial Statistics>Summarized Monetary Survey; interactive table"
    }
  },
  {
    "country_name": "Australia",
    "alpha2_code": "AU",
    "alpha3_code": "AUS",
    "numeric_code": 36,
    "source": {
      "source_url": "https://www.rba.gov.au/statistics/tables/#money-and-credit",
      "source_url_2": null,
      "notes": null
    },
    "target": {
      "data_type": "Direct Excel",
      "direct_download_url": "https://www.rba.gov.au/statistics/tables/xls/d03hist.xlsx?v=2026-08-10-12-51-18",
      "update_frequency": "Monthly",
      "requires_js": false,
      "notes": "Statistics>Statistical Tables>Money and Credit>Monetary Aggregates D3 XLSX; direct downloadable Excel with historical monetary aggregates incl. deposits"
    }
  },
  {
    "country_name": "Austria",
    "alpha2_code": "AT",
    "alpha3_code": "AUT",